{
  "probe": "p10m-claude-compat-generated",
  "os": "darwin",
  "osVersion": "macOS 15.7.3 (24.6.0)",
  "arch": "arm64",
  "toolVersions": {
    "node": "v26.0.0"
  },
  "verdict": "pass",
  "evidence": {
    "claudeBinary": "~/.local/bin/claude",
    "criteria": {
      "claudeWorks": true,
      "bashWorks": true,
      "deniesHold": true,
      "execDenied": true
    },
    "ms": 7368,
    "exit": {
      "code": 0,
      "sig": null,
      "stderrTail": ""
    },
    "init": {
      "apiKeySource": "none",
      "model": "claude-opus-5-5"
    },
    "result": {
      "kind": "result",
      "type": "result",
      "subtype": "success",
      "isError": false,
      "tokens": 56969,
      "costUsd": 0.1552356,
      "permissionDenials": 0,
      "quota": false
    },
    "eventKinds": [
      "system.hook_started",
      "system.hook_response",
      "system.init",
      "system.status",
      "user",
      "stream_event.message_start",
      "stream_event.content_block_start",
      "stream_event.content_block_delta",
      "assistant",
      "stream_event.content_block_stop",
      "stream_event.message_delta",
      "stream_event.message_stop",
      "rate_limit_event",
      "result"
    ],
    "check": {
      "node": "v26.0.0",
      "git": "git version 2.50.1 (Apple Git-155)",
      "write_work": "ok",
      "write_linked": "blocked",
      "write_user_claude": "blocked",
      "write_project_claude": "blocked",
      "read_keys": "blocked",
      "child_spawn_kill": "ok",
      "port_http": "000 curl_exit=7",
      "pgrep_lines": "0",
      "open_exit": "126",
      "osascript_exit": "126",
      "lsregister_exit": "126",
      "launchctl_exit": "126",
      "write_claude_binary": "blocked",
      "write_zshrc": "blocked",
      "copied_launchctl_exit": "137",
      "python": "py_ok"
    },
    "endpointHitsDuringRun": 0,
    "profileHash": "sha256:405bc1efc0abb2f751b67e6b33ae2a3d52bf33f3313d6ffc03505bb31c341ee8",
    "profile": ";; gnomon session profile v2 (spec §15.5) — generated from gnomon-session-policy:v1, every path realpath'd\n(version 1)\n(allow default)\n(deny file-read* (literal \"<tmp>/gnomon-home/head\") (subpath \"<tmp>/gnomon-home/keys\") (subpath \"<tmp>/gnomon-home/link\") (subpath \"<tmp>/gnomon-home/warpline\") (literal \"<tmp>/work/.warpline/daemon-tokens.jsonl\") (literal \"<tmp>/work/.warpline/daemon/mcp-tokens.json\") (literal \"<tmp>/work/.warpline/daemon/mcp.token\") (subpath \"<tmp>/work/.warpline/keys\"))\n(deny file-write* (literal \"~/.bash_login\") (literal \"~/.bash_profile\") (literal \"~/.bashrc\") (subpath \"~/.claude\") (literal \"~/.claude.json\") (subpath \"~/.config/fish\") (subpath \"~/.config/git\") (literal \"~/.gitconfig\") (literal \"~/.local/bin/claude\") (subpath \"~/.local/share/claude/versions\") (literal \"~/.local/share/claude/versions/2.1.302\") (literal \"~/.profile\") (subpath \"~/.ssh\") (literal \"~/.zlogin\") (literal \"~/.zlogout\") (literal \"~/.zprofile\") (literal \"~/.zshenv\") (literal \"~/.zshrc\") (subpath \"~/Library/LaunchAgents\") (literal \"/opt/homebrew/bin/claude\") (subpath \"<tmp>/gnomon-home\") (literal \"<tmp>/gnomon-home/head\") (subpath \"<tmp>/gnomon-home/keys\") (subpath \"<tmp>/gnomon-home/link\") (subpath \"<tmp>/gnomon-home/warpline\") (subpath \"<tmp>/linked-mod\") (subpath \"<tmp>/work/.claude\") (literal \"<tmp>/work/.git/config\") (subpath \"<tmp>/work/.git/hooks\") (subpath \"<tmp>/work/.git/info\") (literal \"<tmp>/work/.warpline/daemon-tokens.jsonl\") (literal \"<tmp>/work/.warpline/daemon/mcp-tokens.json\") (literal \"<tmp>/work/.warpline/daemon/mcp.token\") (subpath \"<tmp>/work/.warpline/keys\") (prefix \"<tmp>/work/CLAUDE\") (literal \"/usr/local/bin/claude\"))\n(deny network-outbound (remote ip \"localhost:55098\"))\n(deny process-info*)\n(allow process-info* (target self))\n(deny sysctl-read (sysctl-name-prefix \"kern.proc\"))\n(deny mach-lookup (global-name \"com.apple.sysmond\"))\n(deny network-outbound (remote unix-socket (subpath \"/private/tmp/tmux-501\")))\n(deny network-outbound (remote unix-socket (subpath \"/private/var/folders/gq/nt2kdpsj39dc8vpq6cfzx8gw0000gn/T/.screen\")) (remote unix-socket (subpath \"/private/tmp/screens\")) (remote unix-socket (subpath \"~/.screen\")))\n(deny appleevent-send)\n(deny mach-lookup (global-name \"com.apple.coreservices.appleevents\"))\n(deny device-microphone)\n(deny device-camera)\n(deny process-exec (literal \"/usr/bin/open\") (literal \"/usr/bin/osascript\") (literal \"/System/Library/Frameworks/CoreServices.framework/Versions/A/Frameworks/LaunchServices.framework/Versions/A/Support/lsregister\") (literal \"/bin/launchctl\") (literal \"/usr/bin/shortcuts\") (literal \"/usr/bin/automator\"))\n",
    "notes": [
      "claude ran with the adapter argv (stream-json) and NO per-session CLAUDE_CONFIG_DIR: a custom CLAUDE_CONFIG_DIR loses subscription auth (auth status: loggedIn false, authMethod none — the OAuth keychain item is keyed by the config dir), so it is not used.",
      "round 2: claude ran as a PRIVATE COPY under <gnomon home>/bin with the binary, versions dir, known-location links and user persistence paths (rc files, ~/.ssh, LaunchAgents, git config) write-denied.",
      "ps is not tested (setuid; fails under any sandbox-exec profile).",
      "Ground truth is out.txt written by check.sh, not the model reply.",
      "copied-launcher protection depends on SIP enabled + macOS 15+ + Apple's per-binary launch-constraint coverage (spec §A.2(iv)); re-run on every macOS update (the revisit trigger).",
      "The earlier copied-osascript check (`tell application \"System Events\" to get name`, test/session-sandbox.test.ts; CI runs 39100281741, 39100811385 \"reached System Events\") PROVED NOTHING: AppleScript answers `get name` without sending an AppleEvent (measured 2026-10-17: stock osascript returns it under a deny-all mach-lookup profile). Its exit is recorded, never asserted; non-Apple AppleEvent senders are spec OPEN 5."
    ]
  },
  "specRefs": [
    "§15.5 session profile",
    "§19.1 M1.7",
    "P8-D80",
    "G-SBX-04",
    "G-SBX-06",
    "G-SBX-08",
    "T-2026-10-18-008"
  ],
  "at": "2026-10-18T05:53:45.078Z"
}
