{
  "probe": "p04-se-helper",
  "os": "darwin",
  "osVersion": "macOS 15.7.3 (24.6.0)",
  "arch": "arm64",
  "toolVersions": {
    "xcode": "Xcode 26.2",
    "node": "v26.0.0"
  },
  "verdict": "partial",
  "evidence": {
    "identity": {
      "present": true,
      "identity": "Developer ID Application: Matthew Canoy (SW4BMQ8PNL)"
    },
    "profile": {
      "present": true,
      "valid": true,
      "path": "~/.config/gnomon-signing/gnomon-helper.provisionprofile",
      "name": "Gnomon Helper Developer ID",
      "uuid": "c388e12f-c99b-4363-9e43-ffa76a67c333",
      "team": [
        "SW4BMQ8PNL"
      ],
      "applicationIdentifier": "SW4BMQ8PNL.gnomon.helper",
      "keychainAccessGroups": [
        "SW4BMQ8PNL.*"
      ],
      "expires": "2044-10-13T01:08:39.000Z",
      "appIdOk": true,
      "groupOk": true,
      "sha256": "04a610410ce3928e"
    },
    "build": {
      "swiftcMs": 1297,
      "codesign": {
        "status": 0,
        "ms": 89,
        "timedOut": false,
        "stderr": "/var/folders/gq/nt2kdpsj39dc8vpq6cfzx8gw0000gn/T/gnomon-probe-helper-b064f9beb7a8/GnomonHelperProbe.app: replacing existing signature"
      },
      "verifyStrict": {
        "ok": true,
        "output": "/var/folders/gq/nt2kdpsj39dc8vpq6cfzx8gw0000gn/T/gnomon-probe-helper-b064f9beb7a8/GnomonHelperProbe.app: valid on disk\n/var/folders/gq/nt2kdpsj39dc8vpq6cfzx8gw0000gn/T/gnomon-probe-helper-b064f9beb7a8/GnomonHelperProbe.app: satisfies its Designated Requirement"
      },
      "details": [
        "Identifier=gnomon.helper",
        "Format=app bundle with Mach-O thin (arm64)",
        "CodeDirectory flags=0x10000(runtime) hashes=34+7 location=embedded",
        "Authority=Developer ID Application: Matthew Canoy (SW4BMQ8PNL)",
        "Authority=Developer ID Certification Authority",
        "Authority=Apple Root CA",
        "Timestamp=Oct 17, 2026 at 6:44:05 PM",
        "TeamIdentifier=SW4BMQ8PNL",
        "Runtime Version=26.2.0"
      ],
      "signedEntitlements": [
        "com.apple.application-identifier",
        "com.apple.developer.team-identifier",
        "keychain-access-groups"
      ],
      "spctl": {
        "status": 3,
        "output": "/var/folders/gq/nt2kdpsj39dc8vpq6cfzx8gw0000gn/T/gnomon-probe-helper-b064f9beb7a8/GnomonHelperProbe.app: rejected\nsource=Unnotarized Developer ID\norigin=Developer ID Application: Matthew Canoy (SW4BMQ8PNL)"
      }
    },
    "info": {
      "bundleId": "gnomon.helper",
      "ok": true,
      "pid": 57223,
      "sandboxed": false,
      "signing": {
        "entitlements": [
          "com.apple.application-identifier",
          "com.apple.developer.team-identifier",
          "keychain-access-groups"
        ],
        "identifier": "gnomon.helper",
        "team": "SW4BMQ8PNL"
      }
    },
    "unsignedCreate": {
      "status": 1,
      "signal": null,
      "timedOut": false,
      "json": {
        "code": -34018,
        "domain": "NSOSStatusErrorDomain",
        "error": "The operation couldn’t be completed. (OSStatus error -34018 - failed to add key to keychain: <SecKeyRef:('com.apple.setoken') 0x6000023d1720>)",
        "ok": false,
        "presence": true,
        "stage": "create"
      }
    },
    "signedCreate": {
      "status": 0,
      "signal": null,
      "timedOut": false,
      "json": {
        "ok": true,
        "presence": true,
        "publicKeyBytes": 65,
        "publicKeySha256": "71ae25b2110e2bda",
        "tag": "gnomon-p04-c39bb475"
      }
    },
    "claims": {
      "a_signedHelperCreatesSeKey": true,
      "b_unsignedRefused": true,
      "b_unsignedCode": -34018
    },
    "pendingFounder": "c (one LAContext signs N times, invalidate, fresh prompt) and d (300-character reason) need Touch ID: run in a terminal: node packages/gnomon/probes/run.mjs p04-se-helper --timeout 1800000",
    "cleanup": {
      "signed": true,
      "unsigned": false
    }
  },
  "specRefs": [
    "§3.1",
    "§3.4 prompt text",
    "§16 keys row",
    "§19.1 M1.0 P04 / S29-01",
    "K2",
    "K5",
    "P8-D68",
    "G-ID-01",
    "G-ID-06"
  ],
  "at": "2026-10-18T01:44:06.223Z"
}
