{
  "probe": "p-noise-vectors",
  "os": "darwin",
  "osVersion": "macOS 15.7.3 (24.6.0)",
  "arch": "arm64",
  "toolVersions": {
    "openssl": "3.6.3",
    "node": "v26.0.0"
  },
  "verdict": "pass",
  "evidence": {
    "vectorSources": {
      "cacophony": {
        "url": "https://raw.githubusercontent.com/haskell-cryptography/cacophony/master/vectors/cacophony.txt",
        "sha256": "3bde7c09a6f349ee11c825c50fcc02649f8f02a47c857a459206b357f9386cae"
      },
      "snow": {
        "url": "https://raw.githubusercontent.com/mcginty/snow/main/tests/vectors/snow.txt",
        "sha256": "69da433305fd045f6c9f01b656662a389d022688986fd39fbe7af009cd402fd3"
      }
    },
    "vectorCount": 5,
    "protocolsPassing": [
      "Noise_IK_25519_ChaChaPoly_SHA256",
      "Noise_XX_25519_ChaChaPoly_SHA256",
      "Noise_XXpsk3_25519_ChaChaPoly_SHA256"
    ],
    "runs": [
      {
        "source": "cacophony",
        "protocol": "Noise_IK_25519_ChaChaPoly_SHA256",
        "messages": 6,
        "pass": true,
        "handshakeHash": {
          "expected": "0b0f68fb0c27e03ce9b97565995ed4838cc0581b762ef72b062f6a546419fad7",
          "initiatorMatch": true,
          "responderMatch": true
        },
        "failures": []
      },
      {
        "source": "cacophony",
        "protocol": "Noise_XX_25519_ChaChaPoly_SHA256",
        "messages": 6,
        "pass": true,
        "handshakeHash": {
          "expected": "c8e5f64e846193be2a834104c2a009868d6c9f3bd3c186299888b488b2f1f58e",
          "initiatorMatch": true,
          "responderMatch": true
        },
        "failures": []
      },
      {
        "source": "cacophony",
        "protocol": "Noise_XXpsk3_25519_ChaChaPoly_SHA256",
        "messages": 6,
        "pass": true,
        "handshakeHash": {
          "expected": "a477edf6a131bbdb54707f6ea30eab6cd935d9b560f0e5fd1f053a95a99669fb",
          "initiatorMatch": true,
          "responderMatch": true
        },
        "failures": []
      },
      {
        "source": "snow",
        "protocol": "Noise_XX_25519_ChaChaPoly_SHA256",
        "messages": 5,
        "pass": true,
        "handshakeHash": {
          "expected": null
        },
        "failures": []
      },
      {
        "source": "snow",
        "protocol": "Noise_IK_25519_ChaChaPoly_SHA256",
        "messages": 4,
        "pass": true,
        "handshakeHash": {
          "expected": null
        },
        "failures": []
      }
    ],
    "tamperRejected": true,
    "primitives": "node:crypto only — X25519 KeyObjects + crypto.diffieHellman, chacha20-poly1305 (12-byte nonce = 4 zero bytes || LE64 counter), sha256, hkdfSync(salt=ck, info=\"\") as Noise HKDF",
    "notIncluded": "Noise_XXpsk3 has one vector (cacophony); snow ships none for it. Rekey and >2^64 nonce paths are untested."
  },
  "specRefs": [
    "research 31 A31-06",
    "G-LNK-11",
    "research 32 (Noise XX/IK via node:crypto)",
    "G-SEC-01 zero deps"
  ],
  "at": "2026-10-17T08:30:11.016Z"
}
