{
  "probe": "p-log-fsync",
  "os": "darwin",
  "osVersion": "macOS 15.7.3 (24.6.0)",
  "arch": "arm64",
  "toolVersions": {
    "sqlite": "3.53.0",
    "node": "v26.0.0"
  },
  "verdict": "pass",
  "evidence": {
    "n": 300000,
    "budgetMs": 5,
    "tmpRoot": "<tmp>/p-log-fsync-2H2UkS",
    "dataVolume": "/dev/disk3s5 on /System/Volumes/Data (apfs, local, journaled, nobrowse, protect, root data)",
    "cpus": "Apple M4",
    "armsMeetingBudget": [
      "F",
      "E",
      "D",
      "C",
      "A"
    ],
    "arms": {
      "F": {
        "arm": "F",
        "desc": "B with head in a sibling subdir of the db dir",
        "n": 300000,
        "wallS": 46.32,
        "checkpoints": 15,
        "total": {
          "p50": 0.144,
          "p90": 0.161,
          "p99": 0.187,
          "p999": 1.108,
          "max": 174.038,
          "over5ms": 102
        },
        "commit": {
          "p50": 0.031,
          "p90": 0.041,
          "p99": 0.058,
          "p999": 0.288,
          "max": 16.84,
          "over5ms": 78
        },
        "anchor": {
          "p50": 0.111,
          "p90": 0.125,
          "p99": 0.138,
          "p999": 0.679,
          "max": 173.29,
          "over5ms": 25
        },
        "slowPer50k": [
          2,
          9,
          2,
          3,
          4,
          82
        ],
        "firstSlowAt": 20000,
        "slowDominatedBy": {
          "commit": 78,
          "anchor": 24
        }
      },
      "E": {
        "arm": "E",
        "desc": "A + head tmp+rename on a 50 ms timer",
        "n": 300000,
        "wallS": 20.302,
        "checkpoints": 15,
        "total": {
          "p50": 0.031,
          "p90": 0.046,
          "p99": 0.102,
          "p999": 7.706,
          "max": 175.502,
          "over5ms": 1123
        },
        "commit": {
          "p50": 0.031,
          "p90": 0.046,
          "p99": 0.098,
          "p999": 7.659,
          "max": 175.161,
          "over5ms": 1108
        },
        "anchor": {
          "p50": 0,
          "p90": 0,
          "p99": 0,
          "p999": 0.152,
          "max": 16.719,
          "over5ms": 15
        },
        "slowPer50k": [
          175,
          187,
          177,
          193,
          194,
          197
        ],
        "firstSlowAt": 7168,
        "slowDominatedBy": {
          "commit": 1108,
          "anchor": 15
        }
      },
      "D": {
        "arm": "D",
        "desc": "A + head tmp+rename every 64 commits",
        "n": 300000,
        "wallS": 21.751,
        "checkpoints": 15,
        "total": {
          "p50": 0.032,
          "p90": 0.048,
          "p99": 0.155,
          "p999": 7.78,
          "max": 228.749,
          "over5ms": 1213
        },
        "commit": {
          "p50": 0.032,
          "p90": 0.047,
          "p99": 0.102,
          "p999": 7.774,
          "max": 228.748,
          "over5ms": 1196
        },
        "anchor": {
          "p50": 0,
          "p90": 0,
          "p99": 0.11,
          "p999": 0.136,
          "max": 35.892,
          "over5ms": 17
        },
        "slowPer50k": [
          359,
          3,
          51,
          338,
          250,
          212
        ],
        "firstSlowAt": 3455,
        "slowDominatedBy": {
          "commit": 1196,
          "anchor": 17
        }
      },
      "C": {
        "arm": "C",
        "desc": "A + head pwrite in place at offset 0, no rename, every commit",
        "n": 300000,
        "wallS": 22.383,
        "checkpoints": 15,
        "total": {
          "p50": 0.034,
          "p90": 0.052,
          "p99": 0.131,
          "p999": 7.787,
          "max": 828.526,
          "over5ms": 1121
        },
        "commit": {
          "p50": 0.032,
          "p90": 0.049,
          "p99": 0.127,
          "p999": 7.77,
          "max": 828.481,
          "over5ms": 1106
        },
        "anchor": {
          "p50": 0.002,
          "p90": 0.003,
          "p99": 0.004,
          "p999": 0.016,
          "max": 104.458,
          "over5ms": 15
        },
        "slowPer50k": [
          206,
          199,
          164,
          218,
          208,
          126
        ],
        "firstSlowAt": 13581,
        "slowDominatedBy": {
          "commit": 1106,
          "anchor": 15
        }
      },
      "B": {
        "arm": "B",
        "desc": "A + head tmp+rename every commit (current anchor.ts)",
        "n": 300000,
        "wallS": 80.032,
        "checkpoints": 15,
        "total": {
          "p50": 0.144,
          "p90": 0.167,
          "p99": 7.145,
          "p999": 7.625,
          "max": 655.028,
          "over5ms": 4411
        },
        "commit": {
          "p50": 0.034,
          "p90": 0.051,
          "p99": 6.99,
          "p999": 7.46,
          "max": 613.512,
          "over5ms": 4383
        },
        "anchor": {
          "p50": 0.109,
          "p90": 0.122,
          "p99": 0.149,
          "p999": 0.248,
          "max": 551.448,
          "over5ms": 32
        },
        "slowPer50k": [
          758,
          602,
          921,
          651,
          658,
          821
        ],
        "firstSlowAt": 6076,
        "slowDominatedBy": {
          "commit": 4381,
          "anchor": 30
        }
      },
      "A": {
        "arm": "A",
        "desc": "raw SQLite (kernel-log pragmas) only",
        "n": 300000,
        "wallS": 22.092,
        "checkpoints": 15,
        "total": {
          "p50": 0.031,
          "p90": 0.044,
          "p99": 0.087,
          "p999": 7.788,
          "max": 535.84,
          "over5ms": 1236
        },
        "commit": {
          "p50": 0.031,
          "p90": 0.044,
          "p99": 0.087,
          "p999": 7.785,
          "max": 228.519,
          "over5ms": 1221
        },
        "anchor": {
          "p50": 0,
          "p90": 0,
          "p99": 0,
          "p999": 0,
          "max": 535.779,
          "over5ms": 15
        },
        "slowPer50k": [
          263,
          194,
          212,
          204,
          183,
          180
        ],
        "firstSlowAt": 10,
        "slowDominatedBy": {
          "commit": 1221,
          "anchor": 15
        }
      }
    }
  },
  "specRefs": [
    "§3.2",
    "G-LOG-06",
    "M1.2 append p99 <= 5 ms"
  ],
  "at": "2026-10-17T18:12:09.118Z"
}
